{
  "chapter_id": "CH115",
  "mode": "DRAFT",
  "summary": "D3晨，秦無漏以當值配給帳與木牌查出牧場代押者，拒絕族長總印；公線中斷後改用既存貨運窄口，依各小群回覆建立可撤記錄，痛泉仍停用。一名帶頭異族被示懲役線絞殺，搬運者趕到扣環前人已死。可驗口令與役牌記錄公開後，三個原留守籠區重答，其中兩個不在昨日七處內。搬運者因頂替移屍、推架班次取得真操作牌，願配合本班交割，仍須本人在場扳閂；牧律未破。",
  "objectives": {
    "achieved": [
      "當眾查出指定代表身分，拒絕族長總印，建立逐籠逐群可撤回應",
      "示範絞殺先於內應抵達；公開可驗命令而非未經同意的個人傷痛",
      "三個原留守籠區改意願，搬運者只交自己班次的操作牌與時序；尚不破牧律"
    ],
    "unmet": []
  },
  "state_delta": {
    "characters": [
      {
        "id": "C001",
        "before": "右臂廢用、神魂劍痕",
        "after": "傷勢不變，新增左掌木刺傷；未救到示懲者",
        "evidence": "manuscript/vol_02/115_誰代表一族.md"
      }
    ],
    "locations": [
      {
        "id": "LOC-HANDOVER-ACCESS",
        "before": "無操作牌",
        "after": "搬運者因頂移屍推架班取得真牌，承諾在場配合本班；門尚未用來截取",
        "evidence": "manuscript/vol_02/115_誰代表一族.md"
      },
      {
        "id": "LOC-PAIN-SPRING",
        "before": "封泉",
        "after": "仍封泉，只用已存頻率和照影傳話",
        "evidence": "manuscript/vol_02/115_誰代表一族.md"
      }
    ],
    "resources": [
      {
        "id": "RES-POPULATION",
        "before": 49212,
        "after": 49212,
        "evidence": "manuscript/vol_02/115_誰代表一族.md"
      },
      {
        "id": "RES-FOOD-DAYS",
        "before": "D2約五日",
        "after": "D3晨約四日，尚未取得牧場糧",
        "evidence": "manuscript/vol_02/115_誰代表一族.md"
      }
    ],
    "relationships": [
      {
        "id": "REL-REPRESENTATIVE",
        "before": "指定代表要求一印總押",
        "after": "當值糧帳與代押木牌揭其身分，公線中斷；逐群記錄保留撤回",
        "evidence": "manuscript/vol_02/115_誰代表一族.md"
      },
      {
        "id": "REL-CAGE-CHOICE",
        "before": "部分留守",
        "after": "三處原留守區重答：一處屬昨日七處，另兩處始終使用普通照影",
        "evidence": "manuscript/vol_02/115_誰代表一族.md"
      }
    ],
    "technology": [],
    "truth_reveals": []
  },
  "new_facts": [
    {
      "id": "CH115-FACT-1",
      "fact": "一名帶頭異族被役線絞殺，搬運者抵達晚於死亡；與112章死者分列，均未入城。",
      "status": "candidate",
      "suggested_authority": "docs/08_連續性與待決事項.md（初稿候選，待確認）"
    },
    {
      "id": "CH115-FACT-2",
      "fact": "只公開可核驗口令、役牌與執行時刻，個人瀕死影像另封，活人來源遮蔽。",
      "status": "candidate",
      "suggested_authority": "docs/08_連續性與待決事項.md（初稿候選，待確認）"
    }
  ],
  "foreshadows": {
    "triggered": [
      "F051"
    ],
    "added": [],
    "resolved": [
      "本次指定代押代表身分查明"
    ]
  },
  "continuity_risks": [
    "本結果依前章待確認初稿續接，未合併current_state.json。",
    "ARC012尚無原生Harness上下文支援；已使用當章開寫包與人工規則覆核。"
  ],
  "next_modules": [
    "MOD-RULE-AIRWOMB",
    "MOD-RULE-AUTHORIZATION",
    "MOD-CHAR-REMNANTCORE"
  ]
}
